{
 "schema": "claude-cut/script@1",
 "created": "2026-09-28T15:01:40Z",
 "inputs": {
  "script": {
   "path": "legacy/claude-code-wordpress-mcp-setup-script-v2.md",
   "sha256": "2501ab2d23a611201edb7cbfbdd1091e00af3c8ccb69287348c22eba6cc3f860"
  }
 },
 "title": "Connect Claude Code to WordPress with MCP (Then Lock It Down)",
 "preamble": [
  "Bracketed lines are on-screen cues, not narration. `[MG]` marks a motion graphic."
 ],
 "sections": [
  {
   "id": "sec01",
   "title": "Cold open",
   "level": 3,
   "first": 1,
   "last": 13
  },
  {
   "id": "sec02",
   "title": "Step one: a user with the lowest possible role",
   "level": 3,
   "first": 14,
   "last": 19
  },
  {
   "id": "sec03",
   "title": "Step two: an application password",
   "level": 3,
   "first": 20,
   "last": 25
  },
  {
   "id": "sec04",
   "title": "Step three: install the MCP Adapter",
   "level": 3,
   "first": 26,
   "last": 34
  },
  {
   "id": "sec05",
   "title": "The hatch and the cupboard",
   "level": 3,
   "first": 35,
   "last": 46
  },
  {
   "id": "sec06",
   "title": "Step four: the MCP config file",
   "level": 3,
   "first": 47,
   "last": 68
  },
  {
   "id": "sec07",
   "title": "Step five: fire it up",
   "level": 3,
   "first": 69,
   "last": 81
  },
  {
   "id": "sec08",
   "title": "Quick test: what can it actually see?",
   "level": 3,
   "first": 82,
   "last": 86
  },
  {
   "id": "sec09",
   "title": "Put the guard rails up first",
   "level": 3,
   "first": 87,
   "last": 100
  },
  {
   "id": "sec10",
   "title": "Now the abilities",
   "level": 3,
   "first": 101,
   "last": 114
  },
  {
   "id": "sec11",
   "title": "Confession time: I got AI to build the ability too",
   "level": 2,
   "first": 115,
   "last": 132
  },
  {
   "id": "sec12",
   "title": "Inside the ability",
   "level": 2,
   "first": 133,
   "last": 165
  },
  {
   "id": "sec13",
   "title": "End screen",
   "level": 3,
   "first": 166,
   "last": 168
  }
 ],
 "sentences": [
  {
   "n": 1,
   "section": "sec01",
   "para": 1,
   "text": "While I was testing this, Claude Code got into my live WordPress site over SSH, which is not how I'd told it to get in."
  },
  {
   "n": 2,
   "section": "sec01",
   "para": 1,
   "text": "I'll show you exactly how that happened later, and how to stop it happening to you."
  },
  {
   "n": 3,
   "section": "sec01",
   "para": 2,
   "text": "Okay, so some of you are going to hate this."
  },
  {
   "n": 4,
   "section": "sec01",
   "para": 2,
   "text": "AI is everywhere, and we're using it in WordPress in all sorts of different ways now."
  },
  {
   "n": 5,
   "section": "sec01",
   "para": 2,
   "text": "Locally, you can spin up a WordPress site pretty easily with the Studio app and chat to the built-in AI."
  },
  {
   "n": 6,
   "section": "sec01",
   "para": 2,
   "text": "Fine."
  },
  {
   "n": 7,
   "section": "sec01",
   "para": 2,
   "text": "But I wanted to set up my own configuration, using Claude Code, talking to a real site."
  },
  {
   "n": 8,
   "section": "sec01",
   "para": 3,
   "text": "Now, there is official documentation for this."
  },
  {
   "n": 9,
   "section": "sec01",
   "para": 3,
   "text": "It lives on the WordPress GitHub account under the MCP Adapter repository, and it tells you how to connect your site over MCP."
  },
  {
   "n": 10,
   "section": "sec01",
   "para": 3,
   "text": "What it doesn't do is walk you through the couple of things you need in place first, or how to actually build the config file."
  },
  {
   "n": 11,
   "section": "sec01",
   "para": 3,
   "text": "So that's what this video is."
  },
  {
   "n": 12,
   "section": "sec01",
   "para": 4,
   "text": "For those of you who don't know, MCP stands for Model Context Protocol, and all it really is is a standard way for an AI agent to talk to a piece of software."
  },
  {
   "n": 13,
   "section": "sec01",
   "para": 4,
   "text": "Keep that in your back pocket, because I'll give you a better analogy in a minute."
  },
  {
   "n": 14,
   "section": "sec02",
   "para": 5,
   "text": "The first thing to do happens on your live production site, not your local one, because we're going to connect local to production and interrogate the real thing."
  },
  {
   "n": 15,
   "section": "sec02",
   "para": 5,
   "text": "So on your live site, create a new user."
  },
  {
   "n": 16,
   "section": "sec02",
   "para": 5,
   "text": "I've called mine claude-ai, and I've given it a password I'm probably never going to log in with (which doesn't matter for this connection anyway)."
  },
  {
   "n": 17,
   "section": "sec02",
   "para": 6,
   "text": "The important bit is the role."
  },
  {
   "n": 18,
   "section": "sec02",
   "para": 6,
   "text": "Set it to the lowest possible, which is Subscriber."
  },
  {
   "n": 19,
   "section": "sec02",
   "para": 6,
   "text": "A lot of the tutorials out there just generate the password on the admin account they're already logged in as, and you really don't want to hand an AI admin and let it go wild on your site doing things you didn't expect."
  },
  {
   "n": 20,
   "section": "sec03",
   "para": 7,
   "text": "Next, on that same user, scroll down to Application Passwords and generate one."
  },
  {
   "n": 21,
   "section": "sec03",
   "para": 7,
   "text": "If you've not come across these, an application password is a separate credential that lets a piece of software talk to your site without using your actual login."
  },
  {
   "n": 22,
   "section": "sec03",
   "para": 7,
   "text": "Give it a name, hit the button, and WordPress generates it for you and shows it once, so copy it somewhere safe because you won't see it again."
  },
  {
   "n": 23,
   "section": "sec03",
   "para": 8,
   "text": "So now we've got a username and an application password for our claude-ai user."
  },
  {
   "n": 24,
   "section": "sec03",
   "para": 8,
   "text": "On their own, they don't give an AI anything useful to work with."
  },
  {
   "n": 25,
   "section": "sec03",
   "para": 8,
   "text": "They just sit there."
  },
  {
   "n": 26,
   "section": "sec04",
   "para": 9,
   "text": "Now install the official WordPress MCP Adapter plugin."
  },
  {
   "n": 27,
   "section": "sec04",
   "para": 9,
   "text": "As far as I know it's being assessed for the WordPress plugin directory, but at the moment it doesn't live there."
  },
  {
   "n": 28,
   "section": "sec04",
   "para": 9,
   "text": "It lives on GitHub under the official WordPress account, in a repo called `mcp-adapter`, and the link is in the description."
  },
  {
   "n": 29,
   "section": "sec04",
   "para": 10,
   "text": "The easiest way in is the Releases page on that repo, where there's a ready-made `mcp-adapter.zip` to download."
  },
  {
   "n": 30,
   "section": "sec04",
   "para": 10,
   "text": "Upload that through Plugins, Add New, on your live site, and activate it."
  },
  {
   "n": 31,
   "section": "sec04",
   "para": 10,
   "text": "(If you'd rather build it yourself, you can clone the repo and build the zip, but for a live site I'd stick with the tagged release.)"
  },
  {
   "n": 32,
   "section": "sec04",
   "para": 11,
   "text": "Again, on its own, it just sits there."
  },
  {
   "n": 33,
   "section": "sec04",
   "para": 11,
   "text": "A user with an application password does nothing, and having the adapter installed does nothing."
  },
  {
   "n": 34,
   "section": "sec04",
   "para": 11,
   "text": "The magic is in how you put them together, and that's where the analogy comes in."
  },
  {
   "n": 35,
   "section": "sec05",
   "para": 12,
   "text": "Imagine you're a chef (bear with me, I was one once) and you need to get into the ingredients cupboard."
  },
  {
   "n": 36,
   "section": "sec05",
   "para": 12,
   "text": "The MCP server is the doorway into that cupboard."
  },
  {
   "n": 37,
   "section": "sec05",
   "para": 12,
   "text": "The hatch, if you like."
  },
  {
   "n": 38,
   "section": "sec05",
   "para": 13,
   "text": "Inside the cupboard, all the ingredients are in jars, and those jars are the Abilities API."
  },
  {
   "n": 39,
   "section": "sec05",
   "para": 13,
   "text": "An ability is a single thing your site can do, described in a way an AI agent can understand, like creating a post, looking up an order or regenerating delivery slots."
  },
  {
   "n": 40,
   "section": "sec05",
   "para": 13,
   "text": "Nothing is in the cupboard unless somebody has registered it as an ability, and every ability carries a permission check, much like the capabilities your user roles already have."
  },
  {
   "n": 41,
   "section": "sec05",
   "para": 14,
   "text": "So some jars have a padlock on them and some are open, depending on who's asking."
  },
  {
   "n": 42,
   "section": "sec05",
   "para": 14,
   "text": "Our subscriber user can't reach much, whereas an admin could reach a lot more."
  },
  {
   "n": 43,
   "section": "sec05",
   "para": 14,
   "text": "That's the whole point of picking the lowest role."
  },
  {
   "n": 44,
   "section": "sec05",
   "para": 15,
   "text": "What you really need to understand is that the key to the hatch is not the adapter plugin, and it's not the user with the application password."
  },
  {
   "n": 45,
   "section": "sec05",
   "para": 15,
   "text": "The key is the MCP configuration on your local machine."
  },
  {
   "n": 46,
   "section": "sec05",
   "para": 15,
   "text": "That config is what opens the hatch, and the abilities are what's on the shelves once you're in."
  },
  {
   "n": 47,
   "section": "sec06",
   "para": 16,
   "text": "The official docs give you a basic config, but they don't tell you where it lives or how to build it, so let's do that."
  },
  {
   "n": 48,
   "section": "sec06",
   "para": 16,
   "text": "In your local project folder, create a file called `.mcp.json`, which is just a JSON object."
  },
  {
   "n": 49,
   "section": "sec06",
   "para": 17,